Q8K4Z3," Potassium,  Metal-binding,  Nucleotide-binding, Reference proteome,  Lipid transport,  Phosphoprotein, 3D-structure,  Mitochondrion,  Secreted,  Isomerase, NAD,  NADP,  Transit peptide,  Transport"
Q80TR1," Signal,  Receptor,  Transmembrane helix,  Alternative splicing, Reference proteome, Lectin, Cell projection,  Cell junction,  Synaptosome,  Phosphoprotein, 3D-structure,  Glycoprotein,  Transducer,  Membrane,  Synapse,  Cell membrane, Transmembrane,  Methylation,  Disulfide bond,  G-protein coupled receptor"
Q8CBY8," Coiled coil, Acetylation,  Cytoskeleton,  Alternative splicing,  Reference proteome,  Ubl conjugation,  Phosphoprotein, Isopeptide bond,  Cytoplasm"
Q8CIB5," Nucleus,  Reference proteome,  Cytoskeleton,  Lipid-binding,  Wnt signaling pathway,  Cell junction, Phosphoprotein,  Cell adhesion, 3D-structure, Cell shape,  Membrane,  Cell membrane,  Cytoplasm,  Cell projection"
Q8CIN6," Reference proteome,  Repeat,  Alternative splicing, Nucleus,  mRNA splicing,  RNA-binding,  mRNA processing, Activator,  Cytoplasm"
Q9CQR4," Nucleus,  Reference proteome,  Cytoskeleton,  Acetylation, 3D-structure,  Hydrolase,  Cytoplasm, Mitochondrion"
Q9D379,"Acetylation,  Reference proteome,  Microsome,  Hydrolase, Transmembrane helix,  Detoxification, Direct protein sequencing,  Membrane,  Transmembrane,  Endoplasmic reticulum,  Aromatic hydrocarbons catabolism, Methylation"
Q9JKB1,"Thiol protease,  Reference proteome,  Ubl conjugation pathway, Cytoplasm,  Phosphoprotein,  Hydrolase,  Protease"
Q80W54," Transmembrane helix,  Metal-binding, Endoplasmic reticulum,  Reference proteome, Nucleus, Zinc,  Membrane,  Transmembrane,  Hydrolase,  Metalloprotease,  Protease"
Q2NL51,"Acetylation, Kinase,  Nucleotide-binding, Reference proteome,  ATP-binding, Signal transduction inhibitor,  Wnt signaling pathway,  Phosphoprotein,  Neurogenesis,  Serine/threonine-protein kinase,  Glycogen metabolism,  Transferase,  Carbohydrate metabolism"
Q91XI1," Metal-binding,  Reference proteome,  Repeat,  Ubl conjugation, Alternative splicing,  Flavoprotein,  FMN,  Isopeptide bond, Oxidoreductase,  Phosphoprotein,  Zinc-finger,  Zinc, tRNA processing"
Q8K0D5,"Acetylation, Reference proteome, Nucleotide-binding,  Protein biosynthesis,  Phosphoprotein,  Mitochondrion,  Transit peptide,  Elongation factor,  GTP-binding"
Q62095," Nucleus, Acetylation,  Reference proteome,  Nucleotide-binding,  Ubl conjugation,  ATP-binding, Hydrolase,  Helicase,  Direct protein sequencing, Phosphoprotein,  Isopeptide bond,  RNA-binding,  Cytoplasm,  Methylation"
Q8BG05," Nucleus, Acetylation,  Reference proteome,  Alternative splicing,  Repeat,  Ubl conjugation,  mRNA splicing, Spliceosome,  Direct protein sequencing, Phosphoprotein,  Ribonucleoprotein,  RNA-binding, Isopeptide bond,  mRNA processing,  Methylation"
Q8VDK1,"Reference proteome, Alternative splicing,  Mitochondrion,  Transit peptide,  Hydrolase,  Cytoplasm"
Q8BGS2," Nucleus,  Alternative splicing,  Acetylation, Reference proteome, 3D-structure,  Cytoplasm"
Q9D898," Reference proteome,  Cytoskeleton, Phosphoprotein,  Direct protein sequencing, Actin-binding,  Cytoplasm"
Q99J08," Nucleus,  Reference proteome,  Lipid-binding, Activator,  Transport,  Cytoplasm, Transcription,  Transcription regulation"
Q9JM76," Nucleus, Acetylation,  Actin-binding,  Cytoskeleton, Reference proteome,  Ubl conjugation,  Isopeptide bond,  Phosphoprotein, Direct protein sequencing,  Cytoplasm,  Cell projection"
A2ALS5," Reference proteome, Alternative splicing, Phosphoprotein,  Golgi apparatus,  Membrane,  GTPase activation"
Q6PHN9," Cytoplasmic vesicle,  Reference proteome,  Coated pit,  Lipoprotein,  Nucleotide-binding,  Protein transport,  GTP-binding, Transport,  Direct protein sequencing, Phosphoprotein, Endosome,  Membrane,  Prenylation, Cell membrane"
Q60817," Nucleus, Acetylation,  Alternative splicing, Reference proteome,  Protein transport,  Ubl conjugation,  Chaperone,  Phosphoprotein, Isopeptide bond,  Transcription,  DNA-binding,  Transport,  Cytoplasm"
Q922D8," Ligase, Acetylation, Methionine biosynthesis,  Multifunctional enzyme,  Nucleotide-binding, One-carbon metabolism,  ATP-binding,  Oxidoreductase,  Purine biosynthesis, Reference proteome,  Phosphoprotein, Direct protein sequencing,  NADP,  Histidine biosynthesis,  Hydrolase,  Cytoplasm,  Amino-acid biosynthesis"
Q8CBE3," Nucleus,  Reference proteome,  Repeat,  WD repeat, Cytoplasm"
Q8CE50," Transport,  Reference proteome, Phosphoprotein,  Protein transport"
Q9Z140," Cytoplasmic vesicle,  Metal-binding,  Reference proteome, Calcium,  Endosome, Differentiation,  Membrane,  Cell membrane,  Cytoplasm, Repeat,  Cell projection"
Q8BL97," Nucleus, Acetylation,  Reference proteome,  Alternative splicing,  Repeat, Transport,  Ubl conjugation,  mRNA splicing,  Repressor, Phosphoprotein, Metal-binding,  Isopeptide bond,  mRNA transport,  Zinc-finger,  RNA-binding,  mRNA processing,  Cytoplasm,  Zinc"
Q920N7," Transmembrane helix,  Cytoplasmic vesicle,  Repeat, Reference proteome, Cell junction,  Phosphoprotein,  Membrane,  Synapse,  Transmembrane"
Q99LG2," Nucleus, Acetylation,  Reference proteome,  Protein transport,  Transport,  Cytoplasm, Repeat"
O89084," Reference proteome,  Ubl conjugation, Alternative splicing,  cAMP,  Isopeptide bond, Metal-binding,  Phosphoprotein,  Hydrolase,  Cytoplasm"
O54865," Heme,  Reference proteome, cGMP biosynthesis,  Nucleotide-binding,  Cytoplasm, Metal-binding,  Lyase,  Iron,  GTP-binding"
Q6AXD9," Transmembrane helix,  Reference proteome, Alternative splicing,  Phosphoprotein,  Membrane, Transmembrane"
Q80WM4," Signal,  Reference proteome,  Repeat, Immunoglobulin domain,  Glycoprotein,  Extracellular matrix,  Secreted, Disulfide bond,  Hyaluronic acid"
E9Q6P5," Reference proteome,  Phosphoprotein,  Membrane,  TPR repeat,  Cytoplasm, Repeat, Cell membrane"
F6ZDS4," Reference proteome, Coiled coil, Acetylation,  Cytoskeleton,  Nuclear pore complex, Transport,  Cell cycle,  Centromere, Mitosis,  Membrane,  Proto-oncogene,  Nucleus,  Translocation,  Cell division, Protein transport,  Chromosome,  mRNA transport,  Phosphoprotein,  Kinetochore,  Cytoplasm,  Methylation"
Q61062,"Reference proteome,  Developmental protein,  Ubl conjugation,  Wnt signaling pathway, Cytoplasm,  Phosphoprotein,  Methylation"
Q6NSW3," Phosphoprotein,  Cytoplasm,  Reference proteome, Alternative splicing"
Q9CY58,"Acetylation,  Reference proteome,  Alternative splicing, Nucleus,  Ubl conjugation,  Isopeptide bond,  Phosphoprotein,  RNA-binding,  Cytoplasm,  Methylation"
Q8BH44," Coiled coil,  Reference proteome,  Cytoskeleton,  WD repeat, Actin-binding,  Cytoplasm, Repeat"
Q9QZB7," Reference proteome,  Cytoskeleton, Cytoplasm"
P20444,"Reference proteome,  Polymorphism,  ATP-binding,  Transferase,  Angiogenesis, Acetylation,  Mitochondrion,  Membrane,  Calcium,  Nucleus,  Repeat,  Cell adhesion, Zinc,  Serine/threonine-protein kinase, Cell membrane,  Metal-binding, Nucleotide-binding,  Phosphoprotein,  Zinc-finger,  Kinase,  Cytoplasm,  Apoptosis"
Q6URW6,"Calmodulin-binding,  Coiled coil, Acetylation,  Actin-binding,  Alternative splicing,  Nucleotide-binding, Reference proteome,  ATP-binding,  Cell shape,  Direct protein sequencing,  Phosphoprotein,  Myosin, Motor protein"
A2BH40," Nucleus, Acetylation,  Reference proteome,  Alternative splicing,  Phosphoprotein,  Neurogenesis,  Chromatin regulator,  DNA-binding, Transcription, Methylation,  Transcription regulation"
Q9JHL1," Nucleus,  Repeat, Reference proteome, Alternative splicing,  Phosphoprotein,  Membrane,  Cell membrane"
Q6P5E4," Signal, Endoplasmic reticulum, Reference proteome,  Glycosyltransferase,  Phosphoprotein,  Glycoprotein,  Transferase"
Q64442,"Acetylation,  Metal-binding,  Oxidoreductase,  Reference proteome, Mitochondrion,  Flagellum,  Phosphoprotein, Zinc,  NAD,  Membrane,  Cilium,  Cell projection"
P14869," Nucleus,  Reference proteome,  Direct protein sequencing, Phosphoprotein, Cytoplasm,  Isopeptide bond,  Ribonucleoprotein,  Ribosomal protein, Ubl conjugation"
B2RXS4," Signal,  Receptor,  Reference proteome,  Transmembrane helix,  Developmental protein, Glycoprotein,  Phosphoprotein, 3D-structure,  Membrane,  Transmembrane,  Cell membrane, Repeat,  Disulfide bond"
Q8R1B5," Coiled coil,  Neurotransmitter transport, Membrane,  Lipoprotein, Reference proteome,  Sensory transduction, Cell junction,  Synapse,  Prenylation,  Cell membrane,  Exocytosis,  Vision,  Transport,  Methylation"
Q9JKK1," Coiled coil, Acetylation,  Reference proteome,  Alternative splicing,  Protein transport, Phosphoprotein,  Golgi apparatus,  Membrane,  Transmembrane, Transmembrane helix,  Transport"
Q9WUM3," Coiled coil,  Reference proteome,  Cytoskeleton,  Repeat, WD repeat,  Phosphoprotein, Actin-binding, Direct protein sequencing,  Cytoplasm"
P56565," Reference proteome,  Repeat,  Metal-binding, S-nitrosylation, Calcium,  Cytoplasm"
Q9CRY7," Transmembrane helix,  Metal-binding,  Hydrolase, Reference proteome, Cytoplasm,  Membrane,  Transmembrane,  Endoplasmic reticulum"
Q80UJ7," Phosphoprotein,  Reference proteome, Cytoplasm,  GTPase activation"
P56371," Lipoprotein, Nucleotide-binding,  Protein transport, Reference proteome, Cytoplasm,  Phosphoprotein,  Membrane,  Prenylation,  Transport,  Endosome,  Methylation,  GTP-binding"
P55096,"Acetylation,  Reference proteome,  Nucleotide-binding,  ATP-binding,  Phosphoprotein,  Glycoprotein,  Membrane,  Transmembrane, Peroxisome, Transmembrane helix,  Transport"
Q9ERU9," Reference proteome,  RNA-binding, Methylation, Acetylation,  Nuclear pore complex,  Membrane,  Nucleus,  Translocation,  Repeat, Protein transport,  Zinc,  Disulfide bond,  Metal-binding,  Ubl conjugation, Transferase,  Isopeptide bond,  mRNA transport,  Phosphoprotein,  Zinc-finger,  TPR repeat, Ubl conjugation pathway,  Transport"
P35293,"Acetylation,  Developmental protein,  Lipoprotein,  Nucleotide-binding,  Protein transport, Reference proteome,  Phosphoprotein, Palmitate,  Membrane, Lipid droplet,  Cell membrane,  Prenylation,  Transport,  Methylation,  GTP-binding"
Q99KP3,"Acetylation,  Oxidoreductase, Reference proteome,  Phosphoprotein,  NAD,  Cytoplasm"
P47911,"Acetylation,  Reference proteome, Phosphoprotein,  Isopeptide bond,  Ribonucleoprotein,  Ribosomal protein,  Endoplasmic reticulum, Ubl conjugation,  Cytoplasm"
Q9Z2X1," Nucleus, mRNA processing,  Repeat,  Alternative splicing,  Acetylation, Reference proteome,  mRNA splicing,  Isopeptide bond,  Phosphoprotein, 3D-structure,  Ribonucleoprotein,  RNA-binding,  Spliceosome, Ubl conjugation"
Q5SSM3," Reference proteome, GTPase activation, Alternative splicing,  Cell junction,  Phosphoprotein,  Synapse,  Endosome,  Cell projection"
O89079,"Golgi apparatus,  Cytoplasmic vesicle, Reference proteome,  Protein transport,  Ubl conjugation,  ER-Golgi transport,  Phosphoprotein, 3D-structure,  Membrane,  Transport,  Cytoplasm"
Q5F2E8," DNA repair,  Coiled coil,  Reference proteome, Apoptosis, Kinase,  Nucleotide-binding,  ATP-binding, Serine/threonine-protein kinase,  Phosphoprotein,  DNA damage,  Cytoplasm,  Transferase"
Q91V09," Nucleus,  Repeat, Reference proteome,  WD repeat,  Phosphoprotein, Direct protein sequencing,  Methylation"
Q62165," Nucleus,  Transmembrane helix,  Reference proteome,  Cytoskeleton,  Postsynaptic cell membrane,  Cell junction, Phosphoprotein, 3D-structure,  Glycoprotein,  Host-virus interaction,  Secreted,  Membrane, Disulfide bond,  Cell membrane,  Synapse, Signal,  Transmembrane,  Cytoplasm"
Q9JM13," Coiled coil, Ubl conjugation, Acetylation,  Metal-binding,  Reference proteome,  Protein transport,  Ubl conjugation pathway, Phosphoprotein,  Endosome,  Zinc-finger,  Endocytosis,  Transport,  Cytoplasm,  Zinc"
Q9ES56,"Golgi apparatus,  Reference proteome,  Postsynaptic cell membrane, Synapse,  ER-Golgi transport, Cell junction,  Membrane,  Cell membrane,  Endoplasmic reticulum,  Transport"
Q9D486," Nucleus,  Reference proteome,  Repeat, Alternative splicing, Phosphoprotein,  Cytoplasm,  Leucine-rich repeat"
Q9CX56," Proteasome,  Reference proteome, Isopeptide bond,  Ubl conjugation"
Q03137," Transmembrane helix,  Reference proteome,  Alternative splicing,  Nucleotide-binding,  ATP-binding, Cell junction,  Transmembrane,  Cell membrane, Repeat,  Transferase,  Signal,  Receptor, Endosome,  Membrane, Tyrosine-protein kinase,  Developmental protein,  Cell adhesion, 3D-structure,  Neurogenesis,  Postsynaptic cell membrane, Phosphoprotein,  Glycoprotein,  Synapse,  Kinase,  Cell projection"
P83940," Nucleus, Transcription regulation,  Reference proteome,  Ubl conjugation pathway, 3D-structure,  Transcription"
Q9Z2W0," Metal-binding,  Reference proteome, Phosphoprotein, Aminopeptidase,  Hydrolase,  Cytoplasm,  Zinc,  Metalloprotease,  Protease"
Q9D880," Translocation, Reference proteome,  Protein transport,  Phosphoprotein,  Mitochondrion, Mitochondrion inner membrane, Direct protein sequencing,  Membrane,  Transmembrane,  Transit peptide, Transmembrane helix,  Transport"
Q61024," Asparagine biosynthesis,  Ligase, Acetylation,  Nucleotide-binding, Reference proteome,  ATP-binding,  Phosphoprotein,  Amino-acid biosynthesis, Glutamine amidotransferase"
P46737," DNA repair,  Nucleus,  Metal-binding,  Cytoskeleton,  Alternative splicing,  Acetylation,  Cell division,  Cell cycle, Hydrolase,  Reference proteome,  Ubl conjugation pathway, Phosphoprotein, 3D-structure, Chromatin regulator,  DNA damage, Zinc,  Mitosis,  Cytoplasm,  Metalloprotease,  Protease"
P34152," Alternative promoter usage,  Reference proteome,  Acetylation,  Nucleotide-binding,  ATP-binding, Developmental protein,  Direct protein sequencing,  Angiogenesis,  Cytoskeleton,  Cell junction,  Nucleus, Membrane, Alternative splicing, 3D-structure, Cell membrane,  Tyrosine-protein kinase,  Ubl conjugation, Transferase,  Isopeptide bond,  Phosphoprotein,  Kinase,  Cytoplasm,  Cell projection"
Q8R317," Nucleus, Acetylation,  Autophagy,  Alternative splicing, Cytoplasmic vesicle, Membrane,  Reference proteome,  Ubl conjugation,  Proteasome,  Direct protein sequencing,  Cell membrane,  Endoplasmic reticulum,  Cytoplasm"
O88878," Metal-binding,  Acetylation, Reference proteome,  Ubl conjugation pathway,  Phosphoprotein, 3D-structure,  Zinc-finger,  Cytoplasm,  Zinc"
P47199,"Acetylation,  Oxidoreductase, Reference proteome,  Phosphoprotein,  RNA-binding,  NADP,  Cytoplasm"
P48542," Reference proteome,  Alternative splicing,  Voltage-gated channel,  Potassium transport,  Direct protein sequencing, Disease mutation,  Ion channel,  Phosphoprotein, 3D-structure,  Ion transport,  Membrane,  Transmembrane, Potassium, Transmembrane helix,  Transport"
O54988," Coiled coil,  Reference proteome, Kinase,  Nucleotide-binding, Alternative splicing,  ATP-binding, Serine/threonine-protein kinase,  Phosphoprotein,  Cytoplasm,  Transferase,  Apoptosis"
Q8JZW4," Metal-binding,  Repeat, Reference proteome, Calcium,  Phosphoprotein,  Differentiation,  Cell projection"
Q9CV63,"Acetylation,  Alternative splicing, Reference proteome, Metal-binding,  Mitochondrion,  Transit peptide,  Hydrolase,  Zinc,  Disulfide bond,  Metalloprotease,  Protease"
Q9R0D8," Ubl conjugation,  Repeat,  WD repeat, Reference proteome"
P36993," Metal-binding,  Reference proteome, Protein phosphatase,  Lipoprotein, Alternative splicing, Magnesium,  Ubl conjugation,  Isopeptide bond,  Phosphoprotein,  Manganese,  Membrane,  Hydrolase,  Cytoplasm,  Myristate"
Q9QXB9," Nucleus,  Metal-binding,  Reference proteome,  Hydrolase, Nucleotide-binding,  Ubl conjugation,  Hydroxylation, Cytoplasm,  Magnesium,  GTP-binding"
O54833,"Acetylation,  Reference proteome, Serine/threonine-protein kinase, Nucleotide-binding,  ATP-binding,  Cell cycle,  Wnt signaling pathway, Transferase,  Phosphoprotein,  Transcription,  Kinase,  Transcription regulation,  Apoptosis"
Q61074," Nucleus, Acetylation,  Metal-binding, Membrane,  Lipoprotein, Protein phosphatase,  Cell cycle,  Reference proteome,  Repeat,  Magnesium,  Phosphoprotein,  Manganese,  Myristate,  Hydrolase,  Methylation"
P84096," Reference proteome,  Lipoprotein, Nucleotide-binding,  Phosphoprotein,  Membrane,  Prenylation, Cell membrane,  Methylation,  GTP-binding"
Q8VD75," Coiled coil,  Nucleus, Cytoplasmic vesicle,  Reference proteome, Neurodegeneration, Transcription,  Activator,  Phosphoprotein,  Endocytosis, Actin-binding,  Membrane,  Cytoplasm,  Differentiation,  Transcription regulation,  Apoptosis"
Q6PB66," Nucleus, Transcription regulation, Acetylation,  Reference proteome,  Repeat, Phosphoprotein,  mRNA transport,  Mitochondrion,  RNA-binding,  Transcription,  Membrane,  DNA-binding,  Transit peptide,  Transport"
Q6P5F9," Nucleus,  Reference proteome,  Repeat,  Acetylation, Transport,  Protein transport, Phosphoprotein,  mRNA transport, 3D-structure,  RNA-binding,  Cytoplasm"
Q8VDM4,"Acetylation,  Repeat,  Reference proteome,  Proteasome,  Phosphoprotein"
P70290," SH3 domain, Acetylation,  Reference proteome,  Lipoprotein,  Phosphoprotein, Palmitate,  Membrane,  Cell membrane,  Cell projection"
P26369," Nucleus,  Reference proteome,  Repeat,  Acetylation,  Ubl conjugation,  Hydroxylation,  Isopeptide bond,  Phosphoprotein, 3D-structure, mRNA splicing, Repressor,  mRNA processing,  RNA-binding"
Q9CQH7," Phosphoprotein,  Reference proteome, Methylation"
Q9CZW4," Fatty acid metabolism, ATP-binding,  Reference proteome, Transmembrane helix,  Microsome, Lipid metabolism,  Nucleotide-binding,  Magnesium, Phosphoprotein,  Signal-anchor,  Mitochondrion,  Membrane,  Transmembrane,  Peroxisome,  Endoplasmic reticulum, Mitochondrion outer membrane,  Ligase"
Q99KK7," Aminopeptidase, Metalloprotease, Acetylation,  Metal-binding,  Reference proteome,  Hydrolase,  Cytoplasm,  Zinc,  Protease"
Q64336," Nucleus, Transcription regulation,  Reference proteome,  Phosphoprotein,  Transcription, DNA-binding"
P10711," Nucleus, Acetylation,  Metal-binding,  Alternative splicing, Reference proteome,  Zinc,  Direct protein sequencing,  Phosphoprotein,  Zinc-finger, Isopeptide bond,  Transcription,  DNA-binding, Ubl conjugation,  Transcription regulation"
P11276," Signal,  Angiogenesis,  Reference proteome,  Repeat,  Alternative splicing,  Cell shape, Pyrrolidone carboxylic acid, Glycoprotein,  Isopeptide bond,  Phosphoprotein, 3D-structure,  Heparin-binding, Sulfation,  Extracellular matrix,  Secreted,  Oxidation,  Disulfide bond,  Acute phase, Cell adhesion"
P61089," Nucleus, Acetylation, DNA repair,  Nucleotide-binding,  ATP-binding, Reference proteome,  Ubl conjugation,  Ubl conjugation pathway,  Direct protein sequencing,  Isopeptide bond,  DNA damage,  Cytoplasm,  Transferase"
Q8K0E8," Coiled coil,  Signal,  Reference proteome, Adaptive immunity,  Hemostasis, Glycoprotein,  Innate immunity, Secreted,  Immunity,  Blood coagulation,  Disulfide bond"
Q62093," Nucleus, Acetylation, Reference proteome,  mRNA splicing,  Phosphoprotein,  RNA-binding,  mRNA processing"
Q68FD9," Transmembrane helix,  Reference proteome, Cell projection,  Phosphoprotein,  Membrane, Transmembrane"
O54724," Coiled coil,  Reference proteome, Endoplasmic reticulum,  Acetylation,  Microsome, Nucleus,  Repeat,  Ubl conjugation,  Isopeptide bond,  Phosphoprotein, 3D-structure,  Mitochondrion,  RNA-binding, rRNA-binding,  Membrane,  Transcription,  Cell membrane, Transcription termination,  Cytoplasm,  Transcription regulation"
O35286," Nucleus, Acetylation, mRNA processing,  Reference proteome,  Nucleotide-binding,  Ubl conjugation,  ATP-binding,  mRNA splicing,  Helicase, Phosphoprotein,  Isopeptide bond,  Hydrolase"
Q9R0N7," Transmembrane helix,  Reference proteome,  Lysosome,  Alternative splicing,  Lipoprotein, Cell junction,  Cell membrane,  Calmodulin-binding, Palmitate,  Membrane,  Calcium, Transmembrane,  Cytoplasmic vesicle,  Repeat, 3D-structure,  Peroxisome,  Metal-binding,  Phosphoprotein, Exocytosis,  Synapse,  Methylation,  Cell projection"
O35607," Signal, ATP-binding,  Metal-binding,  Receptor,  Reference proteome,  Nucleotide-binding, Magnesium, Serine/threonine-protein kinase, Transmembrane helix, Phosphoprotein,  Glycoprotein,  Manganese,  Membrane,  Transmembrane,  Cell membrane,  Kinase,  Transferase,  Disulfide bond"
Q8BH66," Coiled coil, Golgi apparatus, Acetylation,  Reference proteome,  Transmembrane helix,  Hydrolase,  Nucleotide-binding,  GTP-binding, Phosphoprotein,  Membrane,  Transmembrane,  Endoplasmic reticulum,  Cell projection"
Q5SWT3," Transmembrane helix,  Reference proteome, Membrane,  Mitochondrion,  Mitochondrion inner membrane,  Transmembrane,  Transport, Repeat"
Q99LD4," Nucleus,  Signalosome, Reference proteome, Alternative splicing,  Phosphoprotein,  Cytoplasm"
Q9QUJ7,"Peroxisome, Microsome,  Transmembrane helix,  Mitochondrion outer membrane,  Reference proteome,  Nucleotide-binding, Alternative splicing,  ATP-binding,  Magnesium,  Signal-anchor, Fatty acid metabolism,  Phosphoprotein,  Mitochondrion,  Membrane, Transmembrane,  Cell membrane,  Endoplasmic reticulum,  Lipid metabolism,  Ligase"
Q9QUP5," Reference proteome,  Repeat, Immunoglobulin domain,  Glycoprotein,  Extracellular matrix,  Secreted, Disulfide bond,  Hyaluronic acid"
Q62083,"Lipoprotein,  Metal-binding,  Cytoskeleton,  Zinc, Reference proteome,  Cell junction,  Synaptosome,  Phosphoprotein, Actin-binding,  Membrane,  Calcium,  Synapse,  Cytoplasm,  Palmitate"
Q9JLT4," Reference proteome,  Oxidoreductase,  Alternative splicing,  Flavoprotein, Redox-active center,  FAD,  Selenocysteine,  Direct protein sequencing, 3D-structure,  Mitochondrion, Disulfide bond,  NADP,  Transit peptide"
P55012," Symport,  Potassium, Acetylation, Reference proteome,  Transport,  Potassium transport,  Sodium,  Chloride,  Phosphoprotein,  Glycoprotein,  Membrane,  Sodium transport,  Cell membrane,  Transmembrane, Transmembrane helix, Ion transport,  Disulfide bond"
Q8C0M9," Reference proteome, Protease,  Direct protein sequencing, Autocatalytic cleavage,  Hydrolase,  Cytoplasm"
Q9D666," Coiled coil,  Nucleus,  Cytoplasmic vesicle,  Meiosis,  Alternative splicing,  Reference proteome,  Transmembrane helix, Phosphoprotein,  Signal-anchor, Differentiation, 3D-structure,  Spermatogenesis,  Membrane, Transmembrane,  Disulfide bond"
A2ASQ1," Transmembrane helix,  Reference proteome,  Alternative splicing,  Polymorphism,  EGF-like domain, Developmental protein,  Transmembrane,  Cell membrane,  Differentiation, Signal-anchor,  Heparan sulfate,  Cell junction,  Proteoglycan,  Membrane,  Calcium,  Laminin EGF-like domain,  Repeat, 3D-structure,  Disulfide bond, Glycoprotein, Phosphoprotein,  Synapse"
Q3UHB1," Reference proteome, Hydrolase,  Metal-binding,  Magnesium"
Q9CR29," Coiled coil, Reference proteome, Alternative splicing,  Ubl conjugation,  Isopeptide bond,  Phosphoprotein"
Q8K400," Coiled coil,  Reference proteome,  Repeat, Membrane, Transport, Alternative splicing,  Protein transport,  WD repeat,  Phosphoprotein,  Cell membrane,  Exocytosis,  Cytoplasm"
P15327,"Acetylation, Reference proteome,  Phosphoprotein,  Isomerase,  Glycolysis,  Hydrolase"
P60487," Metal-binding,  Cytoskeleton, Pyridoxal phosphate,  Reference proteome,  Magnesium, 3D-structure, Direct protein sequencing,  Membrane,  Cell membrane,  Hydrolase,  Cytoplasm,  Cell projection"
O70161," Reference proteome,  Alternative splicing,  Acetylation, Nucleotide-binding,  ATP-binding,  Chemotaxis,  Cell junction, Cytoplasm, Transferase,  Phosphoprotein, 3D-structure,  Endocytosis,  Membrane,  Cell membrane,  Exocytosis,  Kinase,  Phagocytosis,  Methylation,  Cell projection, Cell adhesion"
Q0VBF8," Reference proteome, Membrane,  Phosphoprotein,  Transmembrane, Transmembrane helix"
Q8K3I4," Cytoplasmic vesicle,  Metal-binding,  Reference proteome,  Repeat, Phosphoprotein,  Zinc-finger, Actin-binding,  Cytoplasm,  Zinc"
Q0KL02," SH3 domain,  Repeat,  Nucleotide-binding, Alternative splicing,  ATP-binding, Reference proteome,  Serine/threonine-protein kinase,  Guanine-nucleotide releasing factor, Transferase,  Endosome, Immunoglobulin domain,  Phosphoprotein, Disulfide bond,  Kinase,  Cytoplasm,  Cell projection"
Q8C522," Signal, Acetylation, Reference proteome,  Direct protein sequencing,  Endonuclease,  Nuclease,  Secreted,  Hydrolase"
Q9D7M1," Nucleus,  Reference proteome,  Ubl conjugation, Cytoplasm, Wnt signaling pathway"
Q921M3," Nucleus,  Reference proteome, Alternative splicing,  mRNA splicing, Phosphoprotein,  Spliceosome,  mRNA processing"
P62264,"Ribosomal protein,  Reference proteome,  Ubl conjugation,  Phosphoprotein,  Ribonucleoprotein, Isopeptide bond"
Q9JLB9," Signal,  Transmembrane helix,  Reference proteome,  Repeat,  Alternative splicing, Membrane,  Postsynaptic cell membrane, Synapse,  Cell junction,  Cell adhesion, 3D-structure,  Glycoprotein,  Disulfide bond,  Immunoglobulin domain,  Transmembrane, Cell membrane"
Q80Y56," Coiled coil, Acetylation,  Reference proteome, Transport,  Lipoprotein,  Protein transport, Metal-binding,  Phosphoprotein,  Zinc-finger,  Membrane,  Cell membrane,  Endosome,  Zinc"
P47955,"Ribosomal protein, Acetylation,  Reference proteome,  Phosphoprotein,  Ribonucleoprotein"
D3YXK2," Coiled coil, Acetylation,  Reference proteome, Transcription, Nucleus,  Ubl conjugation,  Repressor,  Isopeptide bond,  Phosphoprotein,  RNA-binding,  DNA-binding,  Methylation,  Transcription regulation"
Q62383," Coiled coil,  Nucleus, Acetylation,  Reference proteome, Transcription regulation,  mRNA splicing, mRNA transport,  Chaperone,  Phosphoprotein,  mRNA processing,  Transcription,  Transport"
Q6PEB6," Metal-binding, Reference proteome, Cytoplasm,  Phosphoprotein,  Golgi apparatus,  Membrane,  Transport,  Zinc"
Q8BPQ7,"Golgi apparatus,  Cytoplasmic vesicle,  Reference proteome,  Alternative splicing, 3D-structure,  Membrane,  GTPase activation,  Cytoplasm"
Q05D44," Metal-binding, Reference proteome, Nucleotide-binding,  Protein biosynthesis, Cytoplasm,  Phosphoprotein,  Initiation factor,  Hydrolase,  GTP-binding"
