Q8R5M8," Transmembrane helix, Reference proteome,  Immunoglobulin domain,  Differentiation,  Signal,  Cell junction,  Membrane, Transmembrane,  Immunity,  Repeat,  Developmental protein, Alternative splicing,  Cell adhesion,  Spermatogenesis,  Disulfide bond, Cell membrane,  Tumor suppressor, Glycoprotein,  Phosphoprotein,  Synapse,  Apoptosis"
P54823," Nucleus, ATP-binding,  Reference proteome,  Nucleotide-binding,  Ubl conjugation,  Helicase, Phosphoprotein,  RNA-binding,  Hydrolase,  Cytoplasm"
Q9DCM0,"Acetylation,  Metal-binding,  Oxidoreductase, Nucleus,  Reference proteome, Transit peptide,  Phosphoprotein,  Mitochondrion,  Dioxygenase,  Iron,  Cytoplasm"
P35564," Signal,  Transmembrane helix, Acetylation,  Metal-binding,  Repeat,  Lipoprotein, Reference proteome, Lectin,  Chaperone,  Phosphoprotein,  Membrane,  Calcium,  Transmembrane,  Endoplasmic reticulum, Ubl conjugation,  Palmitate,  Disulfide bond"
Q3U1J4," DNA repair,  Nucleus, Acetylation,  Reference proteome,  Ubl conjugation,  Ubl conjugation pathway,  Biological rhythms,  Isopeptide bond,  Phosphoprotein,  DNA damage,  Cytoplasm, Repeat, DNA-binding"
Q3UYC0," Nucleus,  Reference proteome, Alternative splicing, Phosphoprotein,  Hydrolase,  Cytoplasm,  Methylation,  Protein phosphatase"
Q9D3A9," Transmembrane helix,  Reference proteome, Transport, Alternative splicing, Chloride channel, Phosphoprotein,  Chloride,  Cell adhesion,  Ion channel,  Glycoprotein,  Ion transport,  Membrane,  Transmembrane,  Cell membrane"
P63024," Coiled coil, Reference proteome,  Protein transport, Cell junction,  Membrane,  Synapse,  Synaptosome,  Transmembrane, Transmembrane helix,  Transport"
O55106,"Calmodulin-binding,  Coiled coil,  Reference proteome,  Repeat, Membrane,  Cell junction,  WD repeat,  Phosphoprotein,  Synapse,  Cytoplasm,  Cell projection"
P08414," Calmodulin-binding,  Inflammatory response,  Kinase, Adaptive immunity,  Nucleotide-binding, Nucleus,  ATP-binding,  Reference proteome, Serine/threonine-protein kinase, Glycoprotein,  Phosphoprotein,  Calcium,  Immunity,  Cytoplasm,  Transferase"
P26883," Reference proteome, Acetylation, Sarcoplasmic reticulum,  Rotamase,  Isomerase,  Membrane,  Cytoplasm"
Q80U49," Cytoskeleton, Reference proteome, Alternative splicing,  Microtubule,  Phosphoprotein,  Cytoplasm"
Q9D1G1,"Lipoprotein, Acetylation,  Autophagy,  Reference proteome,  Nucleotide-binding,  Protein transport,  Direct protein sequencing,  Phosphoprotein, Prenylation,  Membrane,  Transport,  Cytoplasm,  Methylation,  GTP-binding"
O88952,"Acetylation, Reference proteome,  Postsynaptic cell membrane,  Protein transport,  Transport,  Direct protein sequencing,  Cell junction, Exocytosis,  Membrane,  Synapse,  Cell membrane,  Tight junction"
Q5SSH7,"Acetylation,  Metal-binding,  Alternative splicing,  Lipoprotein,  Reference proteome,  Repeat,  Zinc, Phosphoprotein,  Zinc-finger,  Myristate"
Q9JI91," Metal-binding,  Repeat, Reference proteome,  Ubl conjugation,  Phosphoprotein, Actin-binding,  Calcium,  Cytoplasm"
Q8R1Q8,"ATP-binding,  Nucleotide-binding,  Cell division,  Cell cycle,  Microtubule, Reference proteome,  Chromosome,  Transport,  Direct protein sequencing,  Dynein,  Motor protein, Cytoskeleton,  Phosphoprotein,  Centromere, Mitosis,  Kinetochore,  Cytoplasm"
Q8CIN4,"Acetylation,  Reference proteome, Growth regulation,  Lipoprotein,  Nucleotide-binding,  ATP-binding, Nucleus, Serine/threonine-protein kinase,  Ubl conjugation,  Allosteric enzyme,  Phosphoprotein,  Membrane,  Kinase,  Cytoplasm,  Transferase,  Apoptosis"
P70175," SH3 domain,  Reference proteome,  Repeat, Phosphoprotein"
Q99MN9,"Acetylation,  Reference proteome,  Nucleotide-binding,  ATP-binding, Phosphoprotein,  Mitochondrion,  Transit peptide,  Ligase"
Q8BG39," Transmembrane helix,  Receptor,  Cytoplasmic vesicle,  Reference proteome, Synapse, Neurotransmitter transport, Cell junction,  Glycoprotein,  Phosphoprotein,  Membrane,  Transmembrane,  Transport"
Q9CZ04," Coiled coil,  Nucleus, Acetylation,  Reference proteome,  Alternative splicing,  Signalosome, Phosphoprotein,  Cytoplasm"
Q6ZPQ6," Metal-binding,  Cytoskeleton, Membrane,  Reference proteome,  Lipid-binding, Alternative splicing,  Phosphoprotein,  Calcium,  Cytoplasm,  Methylation"
Q99PJ0," Reference proteome,  Repeat,  Lipoprotein, Signal, Immunoglobulin domain,  Glycoprotein,  Membrane,  Cell membrane,  GPI-anchor,  Disulfide bond, Cell adhesion"
Q8BLF1," Transmembrane helix,  Microsome,  Hydrolase, Reference proteome, Lipid degradation,  Signal-anchor,  Glycoprotein,  Membrane,  Transmembrane,  Endoplasmic reticulum,  Lipid metabolism, Cell membrane"
P56212,"Acetylation,  Reference proteome,  Alternative splicing,  Cell division,  Cell cycle,  Protein phosphatase inhibitor,  Phosphoprotein, Mitosis,  Cytoplasm"
Q9JJC6," Coiled coil,  Reference proteome,  Cytoskeleton, Transport,  Protein transport,  S-nitrosylation, Cell projection, Phosphoprotein,  Cilium,  Cytoplasm"
Q91X97," Metal-binding,  Repeat,  Lipoprotein, Reference proteome, Calcium,  Direct protein sequencing,  Myristate"
Q9D819,"Acetylation,  Reference proteome,  Magnesium,  Direct protein sequencing, Metal-binding,  Phosphoprotein,  Hydrolase,  Cytoplasm"
P43406," Signal,  Receptor,  Metal-binding,  Repeat,  Transmembrane helix,  Developmental protein,  Integrin, Reference proteome, Angiogenesis,  Cell junction,  Cell adhesion,  Glycoprotein,  Membrane,  Calcium,  Cell membrane, Disulfide bond,  Transmembrane, Cleavage on pair of basic residues,  Differentiation"
Q99JY0," Fatty acid metabolism,  Transferase, Acetylation,  Reference proteome, Transit peptide, Lipid metabolism,  Acyltransferase,  Mitochondrion,  Mitochondrion inner membrane,  Membrane,  Endoplasmic reticulum, Mitochondrion outer membrane"
Q9R1T2," Nucleus, Acetylation,  Alternative splicing, Reference proteome,  Ubl conjugation pathway,  Phosphoprotein,  Ligase"
Q812A2," Reference proteome,  Phosphoprotein, Coiled coil,  GTPase activation, SH3 domain"
Q8VDP4," Reference proteome,  Methylation,  Direct protein sequencing,  Biological rhythms, Coiled coil,  mRNA processing, Wnt signaling pathway, Acetylation,  Cell cycle,  Repressor,  Metalloenzyme inhibitor, mRNA splicing,  Transcription regulation,  Nucleus, Isopeptide bond,  Activator,  Ubl conjugation,  Tumor suppressor,  Phosphoprotein,  DNA damage,  Cytoplasm, Transcription,  Apoptosis"
Q9JJK2," Nucleus,  Reference proteome,  Lipoprotein, Phosphoprotein,  Membrane,  Cytoplasm,  Myristate, Cell membrane"
P10852," Transmembrane helix, Ubl conjugation,  Reference proteome,  Lysosome,  Alternative splicing,  Cell junction,  Direct protein sequencing,  Phosphoprotein, 3D-structure,  Glycoprotein,  Disulfide bond, Isopeptide bond,  Membrane,  Transmembrane,  Transport, Cell membrane, Signal-anchor,  Amino-acid transport"
Q9WUA3,"Acetylation,  Metal-binding,  Alternative splicing,  Reference proteome, Nucleotide-binding,  ATP-binding,  Magnesium,  Allosteric enzyme, Cytoplasm,  Phosphoprotein,  Glycoprotein,  Glycolysis,  Kinase,  Transferase"
Q9JK42,"ATP-binding,  Reference proteome,  Nucleotide-binding,  Glucose metabolism, Transferase,  Phosphoprotein,  Transit peptide,  Kinase,  Carbohydrate metabolism, Mitochondrion"
Q921H8," Fatty acid metabolism, Acetylation,  Reference proteome,  Acyltransferase, Peroxisome,  Transit peptide,  Lipid metabolism,  Transferase"
O88685," Nucleus, ATP-binding,  Reference proteome,  Nucleotide-binding, Proteasome,  Phosphoprotein,  Cytoplasm"
Q8K596,"Calmodulin-binding,  Signal,  Transmembrane helix,  Reference proteome,  Repeat, Alternative splicing,  Antiport,  Sodium, Metal-binding,  Phosphoprotein,  Glycoprotein,  Ion transport,  Membrane,  Calcium,  Cell membrane,  Transmembrane, Sodium transport,  Transport,  Calcium transport"
P97315," Nucleus, Acetylation,  Reference proteome,  Repeat,  LIM domain,  Direct protein sequencing, Metal-binding,  Isopeptide bond,  Phosphoprotein, Ubl conjugation,  Zinc"
Q91Z67," Coiled coil,  Nucleus, Cytoplasmic vesicle,  SH3 domain, Reference proteome,  Postsynaptic cell membrane, Cell junction,  Phosphoprotein, Neurogenesis,  Membrane,  GTPase activation,  Cell membrane,  Synapse,  Cytoplasm,  Methylation,  Cell projection"
Q64105," Oxidoreductase,  Acetylation, Reference proteome,  Phosphoprotein, 3D-structure,  NADP,  Cytoplasm"
P60904,"Cytoplasmic vesicle,  Reference proteome,  Acetylation,  Lipoprotein,  Direct protein sequencing,  Chaperone,  Phosphoprotein, 3D-structure, Palmitate,  Membrane,  Cell membrane,  Cytoplasm"
Q9D0E1," Nucleus, Acetylation,  Reference proteome,  Alternative splicing,  Repeat,  Ubl conjugation,  mRNA splicing, Spliceosome,  Direct protein sequencing, Phosphoprotein,  Ribonucleoprotein,  RNA-binding, Isopeptide bond,  mRNA processing,  Methylation"
Q9CZ42,"Acetylation,  Reference proteome,  Alternative splicing,  Nucleotide-binding, Transit peptide,  ATP-binding,  Lyase,  Mitochondrion,  Phosphoprotein,  NAD, NADP"
Q8QZY1,"Acetylation, Reference proteome,  Protein biosynthesis,  Initiation factor,  Cytoplasm"
Q9R0P2," DNA repair,  Nucleus, Acetylation,  Reference proteome,  Alternative splicing,  Ubl conjugation pathway,  Direct protein sequencing, Transferase,  Biological rhythms, Differentiation,  Phosphoprotein,  DNA damage,  Cytoplasm,  Methylation, DNA-binding"
P62881," Repeat,  Alternative splicing, Reference proteome,  Direct protein sequencing,  WD repeat, 3D-structure,  Membrane,  Transducer"
Q91YQ5," Signal,  Transmembrane helix, Acetylation,  Reference proteome, Membrane,  Isopeptide bond,  Glycoprotein,  Transmembrane,  Endoplasmic reticulum, Ubl conjugation"
Q9CZR8,"Reference proteome,  Protein biosynthesis, Elongation factor,  Phosphoprotein,  Mitochondrion,  Transit peptide"
A2AG50," Coiled coil,  Reference proteome, Alternative splicing"
Q80TS3," Signal,  Receptor,  Metal-binding,  Transmembrane helix,  Alternative splicing, Reference proteome, Lectin, Cell projection,  Cell junction,  Phosphoprotein, 3D-structure,  Glycoprotein,  Transducer,  Membrane,  Calcium,  Cell membrane,  Transmembrane,  Disulfide bond,  G-protein coupled receptor"
Q8BU30,"Acetylation, Reference proteome, Nucleotide-binding,  ATP-binding,  Protein biosynthesis,  Phosphoprotein,  Aminoacyl-tRNA synthetase,  Cytoplasm,  Ligase"
O35551," Coiled coil, Acetylation, Cytoplasmic vesicle,  Alternative splicing,  Reference proteome, Protein transport,  Endosome,  Phosphoprotein,  Endocytosis,  Transport,  Cytoplasm,  Apoptosis"
P46935," Reference proteome,  Repeat,  Ubl conjugation, Phosphoprotein, 3D-structure,  Neurogenesis,  Membrane, Ubl conjugation pathway,  Cell membrane,  Cytoplasm,  Transferase"
Q91VK4," Cleavage on pair of basic residues,  Transmembrane helix,  Reference proteome,  Lysosome, Glycoprotein,  Phosphoprotein,  Membrane,  Transmembrane, Cell membrane,  Disulfide bond, Signal-anchor"
Q8JZP2,"ATP-binding,  Cytoplasmic vesicle,  Reference proteome, Nucleotide-binding,  Cell junction,  Phosphoprotein,  Membrane,  Calcium,  Synapse"
Q9CQW1,"Golgi apparatus,  Cytoplasmic vesicle,  Reference proteome,  Lipoprotein,  Protein transport,  ER-Golgi transport, Phosphoprotein, Transferase, Coiled coil,  Membrane,  Prenylation,  Transport,  Cytoplasm,  Methylation,  Palmitate"
Q9Z1R2," Nucleus, Acetylation,  Reference proteome,  Chaperone, Differentiation,  Phosphoprotein,  Spermatogenesis,  Chromatin regulator,  Secreted,  Immunity,  Transport,  Cytoplasm, Repeat,  Apoptosis"
P23506,"Acetylation,  Reference proteome,  Alternative splicing,  S-adenosyl-L-methionine, Methyltransferase,  Direct protein sequencing, Transferase,  Cytoplasm"
O55023," Lithium,  Metal-binding,  Hydrolase, Reference proteome, 3D-structure,  Magnesium,  Cytoplasm"
O09111," Transmembrane helix,  Reference proteome, Transport, Respiratory chain,  Direct protein sequencing,  Electron transport, 3D-structure,  Mitochondrion inner membrane,  Membrane,  Transmembrane,  Transit peptide, Mitochondrion"
O88343," Symport, Transmembrane helix, Reference proteome, Alternative splicing,  Direct protein sequencing,  Sodium,  Phosphoprotein,  Glycoprotein,  Ion transport,  Membrane, Disulfide bond,  Cell membrane,  Sodium transport,  Transmembrane,  Transport"
Q9QUI0," Reference proteome,  Cytoskeleton,  Lipoprotein,  Cell division,  Cell cycle,  GTP-binding, Methylation,  Nucleotide-binding,  Ubl conjugation, Cytoplasm,  Phosphoprotein, 3D-structure, Proto-oncogene,  Membrane,  Prenylation,  Cell membrane,  Hydrolase,  Cell projection"
P61161," Nucleus, Acetylation,  Actin-binding,  Nucleotide-binding, Reference proteome,  ATP-binding,  Direct protein sequencing, Cytoskeleton,  Cytoplasm,  Cell projection"
Q99NE5," Metal-binding,  Reference proteome,  Repeat, Alternative splicing, Synapse, Neurotransmitter transport,  Cell junction, Differentiation,  Phosphoprotein,  Zinc-finger,  Membrane,  Cell membrane,  Exocytosis,  Transport,  Zinc,  Cell projection"
Q9JKK7," Reference proteome,  Cytoskeleton,  Alternative splicing,  Phosphoprotein, Direct protein sequencing, Actin-binding,  Cytoplasm"
P35980,"Reference proteome,  Ubl conjugation, Cytoplasm,  Isopeptide bond,  Phosphoprotein,  Ribonucleoprotein,  Ribosomal protein,  Endoplasmic reticulum"
Q9CZW5," Transmembrane helix, Acetylation,  Mitochondrion outer membrane,  Repeat, Reference proteome,  Direct protein sequencing,  Isopeptide bond,  Phosphoprotein,  Mitochondrion,  Membrane,  TPR repeat,  Transmembrane, Ubl conjugation, Methylation"
Q9CZU6," Transferase,  Tricarboxylic acid cycle,  Reference proteome,  Acetylation, Transit peptide,  Direct protein sequencing,  Phosphoprotein, 3D-structure,  Methylation, Mitochondrion"
P55264," Nucleus,  Metal-binding,  Reference proteome,  Alternative splicing,  Nucleotide-binding, Magnesium,  ATP-binding, Purine salvage,  Phosphoprotein, 3D-structure,  Kinase,  Cytoplasm,  Transferase"
O55022," Transmembrane helix,  Receptor,  Metal-binding,  Reference proteome, Membrane,  Microsome,  Lipid-binding, Steroid-binding,  Phosphoprotein,  Mitochondrion, Direct protein sequencing,  Transmembrane,  Endoplasmic reticulum,  Iron, Mitochondrion outer membrane"
Q60780," Coiled coil,  Alternative splicing, Reference proteome, Developmental protein,  Phosphoprotein, 3D-structure,  Neurogenesis,  Cytoplasm,  Differentiation"
Q9DCW4,"Acetylation,  Reference proteome, Transport,  Nucleotide-binding,  Direct protein sequencing,  Electron transport,  Phosphoprotein,  Methylation, Mitochondrion"
P62918," Reference proteome,  Hydroxylation, Cytoplasm,  Isopeptide bond,  RNA-binding,  Ribosomal protein,  rRNA-binding, Ubl conjugation, Ribonucleoprotein"
Q99LB6,"Reference proteome, Alternative splicing,  One-carbon metabolism,  Phosphoprotein,  NADP"
Q8R001," Reference proteome,  Cytoskeleton,  Cell division,  Cell cycle, Alternative splicing, Microtubule,  Phosphoprotein,  Mitosis,  Cytoplasm"
P22599," Signal,  Reference proteome, Secreted,  Protease inhibitor,  Glycoprotein, Acute phase,  Serine protease inhibitor"
Q9JKY5," Coiled coil,  Cytoplasmic vesicle, Acetylation,  Actin-binding,  Reference proteome, Endocytosis,  Membrane,  Cytoplasm"
Q9Z218," Reference proteome, Membrane,  Direct protein sequencing,  Signal-anchor,  Glycoprotein,  Transmembrane, Cell membrane, Transmembrane helix,  Disulfide bond"
Q501J6," Reference proteome,  Alternative splicing,  Nucleotide-binding,  ATP-binding,  RNA-binding, RNA-mediated gene silencing,  Hydrolase, Acetylation,  mRNA splicing,  Antiviral defense,  Transcription,  Immunity,  rRNA processing,  Nucleus,  Helicase, Cytoplasm, Transcription regulation, mRNA processing,  Ubl conjugation, Phosphoprotein,  Isopeptide bond,  Methylation"
P31230," Nucleus,  Angiogenesis, Acetylation,  tRNA-binding, Reference proteome,  Cytokine,  Protein biosynthesis,  Phosphoprotein,  RNA-binding, Direct protein sequencing,  Golgi apparatus, Inflammatory response,  Secreted,  Endoplasmic reticulum,  Cytoplasm,  Apoptosis"
Q9CQN1,"Acetylation,  Reference proteome,  Nucleotide-binding,  ATP-binding,  Direct protein sequencing,  Chaperone, Phosphoprotein,  Mitochondrion inner membrane,  Membrane,  Transit peptide, Mitochondrion"
Q62465,"Acetylation,  Oxidoreductase, Reference proteome,  Direct protein sequencing,  Phosphoprotein,  Mitochondrion,  Membrane,  Cytoplasm, Mitochondrion outer membrane"
Q9WV98," Translocation, Acetylation,  Metal-binding, Membrane,  Reference proteome, Protein transport,  Direct protein sequencing,  Chaperone,  Mitochondrion,  Mitochondrion inner membrane,  Transport,  Zinc,  Disulfide bond"
P46097," Transmembrane helix,  Cytoplasmic vesicle,  Metal-binding,  Repeat, Reference proteome,  Cell junction, Differentiation, 3D-structure,  Glycoprotein,  Phosphoprotein,  Membrane,  Calcium,  Synapse,  Transmembrane,  Cytoplasm"
Q9D164," Signal,  Reference proteome,  Transport, Alternative splicing,  Direct protein sequencing,  Ion channel,  Membrane,  Transmembrane, Transmembrane helix, Ion transport"
P35585," Cytoplasmic vesicle,  Reference proteome,  Acetylation,  Protein transport, Phosphoprotein, 3D-structure,  Golgi apparatus,  Membrane,  Transport"
P42932,"Acetylation,  Reference proteome,  Ubl conjugation, Nucleotide-binding,  ATP-binding,  Direct protein sequencing,  Chaperone,  Isopeptide bond, Cytoskeleton,  Phosphoprotein,  Cilium,  Cytoplasm,  Cell projection"
Q5PR73," Reference proteome,  Lipoprotein, Nucleotide-binding,  Phosphoprotein,  Membrane,  Prenylation, Cell membrane,  Methylation,  GTP-binding"
Q60676," Nucleus, Acetylation,  Metal-binding, Membrane,  Reference proteome,  Magnesium,  Manganese,  TPR repeat,  Cell membrane,  Hydrolase,  Cytoplasm, Repeat,  Protein phosphatase"
Q922J3," Coiled coil,  Cytoplasmic vesicle,  Cytoskeleton,  Alternative splicing,  Metal-binding,  Reference proteome,  Repeat, Cytoplasm, Microtubule,  Phosphoprotein, 3D-structure, Zinc-finger,  Membrane,  Transport,  Zinc,  Cell projection"
Q62419," Coiled coil,  SH3 domain,  Reference proteome,  Lipid-binding, Phosphoprotein,  Endosome, Cell junction,  Endocytosis, Direct protein sequencing,  Membrane,  Cytoplasm,  Cell projection"
Q8BIW1,"Acetylation,  Metal-binding,  Reference proteome, Nucleus,  Cell junction,  Phosphoprotein,  Manganese,  Hydrolase,  Cytoplasm"
P33173," Coiled coil, Cytoplasmic vesicle,  Cytoskeleton,  Reference proteome, Nucleotide-binding,  ATP-binding,  Microtubule,  Motor protein,  Phosphoprotein, 3D-structure,  Membrane,  Cytoplasm,  Cell projection"
Q148V7," Coiled coil, Acetylation,  Reference proteome,  Alternative splicing,  Repeat,  Phosphoprotein, Lipid transport,  Golgi apparatus,  Transport,  Endosome"
Q61303," Reference proteome,  Repeat,  Alternative splicing,  Lipoprotein, Membrane, Alternative promoter usage,  Hydroxylation,  Direct protein sequencing,  ANK repeat, Cytoskeleton,  Phosphoprotein, Sarcoplasmic reticulum,  Cytoplasm"
Q9DCT2," Ubiquinone,  Translocase,  Oxidoreductase, Transport, Reference proteome,  Respiratory chain,  Direct protein sequencing,  Electron transport, 3D-structure,  Mitochondrion inner membrane,  NAD,  Membrane,  Transit peptide, Mitochondrion"
Q9EP69," Transmembrane helix, Acetylation,  Hydrolase, Reference proteome,  Golgi apparatus,  Membrane,  Transmembrane,  Endoplasmic reticulum"
O88544," Nucleus,  Signalosome,  Cytoplasmic vesicle,  Reference proteome,  Acetylation, Synapse,  Cell junction, 3D-structure, Direct protein sequencing,  Cytoplasm"
P12382,"Acetylation,  Reference proteome,  Nucleotide-binding,  ATP-binding,  Magnesium,  Allosteric enzyme, Transferase, Metal-binding,  Phosphoprotein,  Glycoprotein, Direct protein sequencing,  Glycolysis,  Kinase,  Cytoplasm"
Q8BUV3," Transferase, ATP-binding,  Metal-binding,  Multifunctional enzyme,  Lipoprotein, Nucleotide-binding,  Postsynaptic cell membrane, Reference proteome, Molybdenum cofactor biosynthesis,  Cell junction, Cytoskeleton,  Molybdenum,  Phosphoprotein,  Membrane,  Synapse,  Cell membrane,  Magnesium,  Cytoplasm,  Palmitate,  Cell projection"
Q9QZX7," Metal-binding,  Pyridoxal phosphate,  Alternative splicing, Reference proteome, Nucleotide-binding,  ATP-binding,  S-nitrosylation,  Lyase,  Phosphoprotein, Direct protein sequencing,  Isomerase,  Magnesium, Allosteric enzyme"
Q9WVK8," Heme,  Transmembrane helix,  Cholesterol metabolism, Endoplasmic reticulum,  Microsome,  Oxidoreductase, Reference proteome,  Sterol metabolism,  Steroid metabolism, Metal-binding, Cell junction,  Membrane,  Synapse, Transmembrane,  Lipid metabolism,  Iron,  Monooxygenase,  Cell projection"
O70172," Nucleus, Acetylation,  Reference proteome,  Nucleotide-binding,  ATP-binding, Phosphoprotein, Direct protein sequencing,  Membrane,  Cell membrane,  Kinase,  Cytoplasm,  Transferase"
Q99PU5," Fatty acid metabolism, ATP-binding,  Cytoplasmic vesicle, Endoplasmic reticulum, Membrane,  Microsome,  Nucleotide-binding, Reference proteome,  Phosphoprotein,  Cell membrane,  Lipid metabolism,  Cytoplasm,  Ligase"
P63080," Ligand-gated ion channel, Postsynaptic cell membrane,  Receptor, Cytoplasmic vesicle,  Reference proteome,  Signal,  Chloride channel,  Transmembrane helix,  Transport,  Chloride,  Ion channel, Cell junction,  Glycoprotein,  Membrane,  Synapse,  Cell membrane, Transmembrane, Ion transport,  Disulfide bond"
P63213,"Acetylation,  Reference proteome,  Lipoprotein,  Transducer, Prenylation,  Membrane,  Cell membrane,  Methylation"
Q8BK64," Stress response, Acetylation,  Reference proteome,  Ubl conjugation, Phosphoprotein,  Chaperone,  Isopeptide bond,  Endoplasmic reticulum,  Cytoplasm"
Q8VE33,"Coiled coil,  Reference proteome"
P28656," Nucleus, Lipoprotein, Acetylation,  Reference proteome,  Direct protein sequencing,  Isopeptide bond,  Phosphoprotein,  Neurogenesis, Prenylation,  Cytoplasm,  Methylation"
Q60605,"Acetylation,  Reference proteome,  Alternative splicing,  Direct protein sequencing,  Phosphoprotein,  Myosin,  Muscle protein, Repeat, Motor protein"
Q3UTQ8," Nucleus,  Nucleotide-binding, Alternative splicing,  ATP-binding, Reference proteome,  Serine/threonine-protein kinase, Cytoskeleton,  Phosphoprotein,  Kinase,  Cytoplasm,  Transferase,  Cell projection"
Q80VD1," Nucleus,  Reference proteome, Cytoplasm"
Q9WTX5," Reference proteome,  Ubl conjugation,  Phosphoprotein, Isopeptide bond, Ubl conjugation pathway"
Q99N28," Signal,  Reference proteome,  Repeat, Transmembrane helix,  Cell junction, Phosphoprotein,  Cell adhesion, 3D-structure,  Glycoprotein,  Immunoglobulin domain,  Calcium,  Cell membrane, Disulfide bond,  Membrane,  Transmembrane"
Q6PE13," Transmembrane helix,  Reference proteome, Glycoprotein,  Phosphoprotein,  Membrane,  Transmembrane, Signal,  Methylation"
Q99PL6," Nucleus,  Reference proteome,  Lysosome,  Cytoskeleton, Membrane, Alternative splicing,  Endosome,  Phosphoprotein, Ubl conjugation pathway,  Cytoplasm"
Q9WV55," Coiled coil,  Nucleus,  Reference proteome, Transmembrane helix,  Acetylation,  Cell junction, Phosphoprotein, 3D-structure, Direct protein sequencing,  Membrane,  Transmembrane,  Cell membrane,  Endoplasmic reticulum,  Tight junction"
Q60737," Nucleus,  Reference proteome, Apoptosis, Serine/threonine-protein kinase, Nucleotide-binding,  ATP-binding,  Cell cycle,  Wnt signaling pathway, Transferase,  Biological rhythms,  Phosphoprotein,  Transcription,  Kinase,  Transcription regulation"
Q9CQQ7," Transit peptide, Acetylation, Reference proteome,  Transport,  Direct protein sequencing,  Mitochondrion,  Mitochondrion inner membrane,  CF(0),  Membrane,  Hydrogen ion transport, Ion transport"
Q60634," Reference proteome,  Alternative splicing,  Lipoprotein,  Cell adhesion,  Phosphoprotein, 3D-structure, Palmitate, Direct protein sequencing,  Membrane,  Cell membrane,  Endosome,  Myristate"
Q791V5,"Acetylation,  Reference proteome,  Repeat,  Direct protein sequencing,  Mitochondrion, Mitochondrion inner membrane,  Membrane,  Transmembrane, Transmembrane helix,  Transport"
Q8BVQ5,"Reference proteome,  Serine esterase,  Phosphoprotein, Direct protein sequencing,  Hydrolase,  Methylation"
P09103," Signal, Acetylation, Endoplasmic reticulum,  Reference proteome,  Repeat, Redox-active center,  Chaperone,  Phosphoprotein,  Isomerase,  Membrane,  Cell membrane,  Disulfide bond"
P21619,"Intermediate filament,  Coiled coil, Acetylation,  Reference proteome,  Alternative splicing,  Lipoprotein, Nucleus,  Ubl conjugation,  Direct protein sequencing,  Isopeptide bond,  Phosphoprotein,  Membrane,  Prenylation,  Methylation"
P57746," Reference proteome, Transport,  Direct protein sequencing, Cilium biogenesis/degradation,  Ion transport,  Membrane, Hydrogen ion transport"
Q64516," Mitochondrion outer membrane, Membrane,  Nucleotide-binding, Alternative splicing,  ATP-binding, Reference proteome,  Glycerol metabolism,  Mitochondrion,  Kinase,  Cytoplasm,  Transferase"
Q8R3V5," Coiled coil,  SH3 domain, Acetylation,  Alternative splicing, Reference proteome,  Phosphoprotein,  Cytoplasm"
P54775," Nucleus,  Reference proteome,  Acetylation,  Nucleotide-binding,  ATP-binding, Proteasome,  Phosphoprotein, 3D-structure, Direct protein sequencing,  Cytoplasm"
Q9D415," Reference proteome, Alternative splicing, Phosphoprotein,  Cell junction,  Membrane,  Synapse,  Cell membrane"
B9EKR1," Transmembrane helix,  Reference proteome,  Repeat, Signal, Phosphoprotein,  Glycoprotein,  Secreted,  Membrane,  Transmembrane, Cell membrane,  Hydrolase,  Disulfide bond,  Protein phosphatase"
Q99L43," Phospholipid biosynthesis,  Reference proteome, Endoplasmic reticulum,  Phospholipid metabolism, Phosphoprotein, Nucleotidyltransferase,  Lipid biosynthesis,  Membrane,  Transmembrane, Transmembrane helix,  Lipid metabolism,  Transferase"
